{
  "schemaVersion": 1,
  "kind": "system_catalog",
  "exampleOnly": true,
  "systems": [
    {
      "id": "systemkatalog",
      "name": "Systemkatalog",
      "type": "repository",
      "purpose": "Beschreibt Systeme, Zwecke, Wahrheitszuständigkeiten, stabile Beziehungen und Einstiegspunkte.",
      "notResponsibleFor": [
        "Aufgabenpriorisierung",
        "Runtime-Gesundheit",
        "Merge-Reife",
        "Agentendisposition"
      ],
      "truthOwnership": [
        "ecosystem_semantics"
      ],
      "entrypoints": {
        "repository": "https://github.com/heimgewebe/systemkatalog",
        "readme": "README.md",
        "agentEntry": "AGENTS.md"
      },
      "lifecycle": {
        "state": "active",
        "reviewedAt": "2026-07-26",
        "evidenceRefs": [
          "catalog/system-catalog.example.v1.json"
        ]
      }
    },
    {
      "id": "bureau",
      "name": "Bureau",
      "type": "repository",
      "purpose": "Verwaltet Aufgaben, Queue, Claims, Kandidaten und Receipts.",
      "notResponsibleFor": [
        "Runtime-Ausführung",
        "Merge-Reife",
        "Ökosystem-Semantik"
      ],
      "truthOwnership": [
        "task_state",
        "queue_order",
        "handoff_state"
      ],
      "entrypoints": {
        "repository": "https://github.com/heimgewebe/bureau",
        "readme": "README.md",
        "agentEntry": "AGENTS.md"
      },
      "lifecycle": {
        "state": "active",
        "reviewedAt": "2026-07-26",
        "evidenceRefs": [
          "catalog/system-catalog.example.v1.json"
        ]
      }
    },
    {
      "id": "grabowski",
      "name": "Grabowski",
      "type": "repository",
      "purpose": "Führt freigegebene lokale und repositorybezogene Arbeit aus und erzeugt Receipts.",
      "notResponsibleFor": [
        "Aufgaben-Canon",
        "Runtime-Wahrheit",
        "Ökosystem-Semantik"
      ],
      "truthOwnership": [
        "local_fleet_execution"
      ],
      "entrypoints": {
        "repository": "https://github.com/heimgewebe/grabowski",
        "readme": "README.md",
        "agentEntry": "AGENTS.md"
      },
      "lifecycle": {
        "state": "active",
        "reviewedAt": "2026-07-26",
        "evidenceRefs": [
          "catalog/system-catalog.example.v1.json"
        ]
      }
    },
    {
      "id": "github",
      "name": "GitHub",
      "type": "service",
      "purpose": "Ist Primärquelle für Repositories, Branches, Pull Requests, Issues und Reviews.",
      "notResponsibleFor": [
        "lokale Runtime-Gesundheit",
        "Aufgabenpriorität außerhalb der registrierten Systeme"
      ],
      "truthOwnership": [
        "branches_prs_reviews"
      ],
      "entrypoints": {
        "organization": "https://github.com/heimgewebe"
      },
      "lifecycle": {
        "state": "active",
        "reviewedAt": "2026-07-26",
        "evidenceRefs": [
          "catalog/system-catalog.example.v1.json"
        ]
      }
    },
    {
      "id": "runtime",
      "name": "Runtime",
      "type": "runtime",
      "purpose": "Ist Primärquelle für den tatsächlich laufenden Zustand von Diensten.",
      "notResponsibleFor": [
        "Aufgabenpriorisierung",
        "Merge-Reife",
        "Katalog-Semantik"
      ],
      "truthOwnership": [
        "live_service_state"
      ],
      "entrypoints": {
        "catalogGuidance": "registry/ecosystem/authority-matrix.v1.json"
      },
      "lifecycle": {
        "state": "active",
        "reviewedAt": "2026-07-26",
        "evidenceRefs": [
          "catalog/system-catalog.example.v1.json"
        ]
      }
    }
  ],
  "relations": [
    {
      "from": "systemkatalog",
      "to": "bureau",
      "type": "routes_to",
      "meaning": "Aktuelle Aufgaben- und Queuefragen werden an Bureau verwiesen."
    },
    {
      "from": "bureau",
      "to": "grabowski",
      "type": "authorizes_execution_by",
      "meaning": "Bureau kann freigegebene Arbeit an Grabowski übergeben."
    },
    {
      "from": "grabowski",
      "to": "github",
      "type": "works_with",
      "meaning": "Repositoryänderungen werden über GitHub-Branches und Pull Requests veröffentlicht."
    },
    {
      "from": "systemkatalog",
      "to": "runtime",
      "type": "points_to_truth_owner",
      "meaning": "Systemkatalog verweist für Live-Zustände auf Runtime-Quellen, ohne sie zu kopieren."
    }
  ],
  "truthOwners": [
    {
      "domain": "ecosystem_semantics",
      "owner": "systemkatalog"
    },
    {
      "domain": "task_state",
      "owner": "bureau"
    },
    {
      "domain": "local_fleet_execution",
      "owner": "grabowski"
    },
    {
      "domain": "branches_prs_reviews",
      "owner": "github"
    },
    {
      "domain": "live_service_state",
      "owner": "runtime"
    }
  ]
}
